Marketplace,Brand,Gender,SearchQuery,ProductName,Price
wildberries,Milton Jeans,Men,Брюки,Джоггеры штаны зауженные на резинке свободные,2889
wildberries,ТВОЕ,Men,Брюки,Широкие брюки,2175
wildberries,STATESMAN,Men,Брюки,Брюки классические в офис повседневные,2613
wildberries,ТВОЕ,Men,Брюки,Прямые брюки с декоративной петлей,957
wildberries,Eremes,Men,Брюки,"Джоггеры мужские джинсовые, спортивные брюки на резинке",2521
wildberries,Ludi,Men,Брюки,Брюки вельветовые широкие классические бананы,2201
wildberries,Nike,Men,Брюки,спортивные штаны мужские,1031
wildberries,MARYELLE,Men,Брюки,Спортивные широкие штаны бананы оверсайз,1901
wildberries,Polski,Men,Брюки,Широкие спортивные штаны оверсайз,1589
wildberries,Diona,Men,Брюки,Пижамные брюки трикотажные,734
wildberries,lipkinof,Men,Брюки,Брюки классические на резинке прямые зауженные со стрелками,2751
wildberries,KENSPRIT,Men,Брюки,Джинсы джоггеры штаны бананы широкие,2161
wildberries,ТВОЕ,Men,Брюки,Вельветовые зауженные брюки,2622
wildberries,URBIK,Men,Брюки,Спортивные штаны домашние трико,779
wildberries,ТВОЕ,Men,Брюки,Брюки джоггеры с карманами по бокам,1498
wildberries,INGDROP,Men,Брюки,Спортивные штаны с манжетом больших размеров,1870
wildberries,Umbra Looks,Men,Брюки,Брюки широкие оверсайз багги y2k,3250
wildberries,Milton Jeans,Men,Брюки,Джоггеры штаны зауженные на резинке свободные,2407
wildberries,O'STIN,Men,Брюки,Широкие штаны карго хлопок,1094
wildberries,D13,Men,Брюки,Брюки карго прямые,1887
wildberries,O'STIN,Men,Брюки,Штаны-чиносы прямые с ремнем из экокожи,1495
wildberries,M.D.V.,Men,Брюки,Брюки чиносы прямые,1882
wildberries,O'STIN,Men,Брюки,Брюки классические на завязках,1094
wildberries,ТВОЕ,Men,Брюки,Зауженные широкие брюки,1445
wildberries,Polski,Men,Брюки,Широкие спортивные штаны оверсайз,1516
wildberries,The North Face,Men,Брюки,Спортивные штаны трикотажные,1787
wildberries,Modern Walk,Men,Брюки,Спортивные штаны мужские,2185
wildberries,Natali textile,Men,Брюки,Брюки рабочие спецодежда большие размеры,606
wildberries,ТВОЕ,Men,Брюки,Утепленные брюки джоггеры с начесом,1131
wildberries,ПромДизайн,Men,Брюки,Брюки рабочие,592
wildberries,FUNDAY,Men,Брюки,Брюки,870
wildberries,PijonStyle,Men,Брюки,Спортивные штаны прямые 90х,2163
wildberries,WiWin,Men,Брюки,"Джогеры, брюки карго с ремнем",3248
wildberries,Ticle,Men,Брюки,Спортивные штаны утепленные джоггеры,1712
wildberries,Lyle & Scott,Men,Брюки,Брюки джоггеры спортивные хлопковые на завязках,8247
wildberries,Corteiz,Men,Брюки,Брюки багги,3528
wildberries,MAD Man,Men,Брюки,Брюки бананы широкие оверсайз классические,2268
wildberries,HANDSTER,Men,Брюки,Летние брюки из 100% льна с умягченной тканью для комфорта,4324
wildberries,ТВОЕ,Men,Брюки,Зауженные брюки джоггеры на резинке,932
wildberries,Frutto Rosso,Men,Брюки,Спортивные штаны джоггеры на резинке повседневные,1081
wildberries,Elemental,Men,Брюки,Брюки милитари прямые с карманами,3175
wildberries,ТВОЕ,Men,Брюки,Прямые повседневные брюки,1526
wildberries,ТВОЕ,Men,Брюки,Летние зауженные брюки карго,1817
wildberries,HANDSTER,Men,Брюки,Брюки классические в клетку на резинке,2097
wildberries,ТВОЕ,Men,Брюки,Летние зауженные брюки карго,1609
wildberries,Fich,Men,Брюки,Брюки классические широкие на резинке,2889
wildberries,RIMILLI,Men,Брюки,Штаны sk8 подростковые широкие оверсайз багги трубы у2к,1474
wildberries,Nike,Men,Брюки,Спортивные штаны,1375
wildberries,MARMOR,Men,Брюки,Джоггеры без начеса штаны спортивные оверсайз у2к y2k,1911
wildberries,ТВОЕ,Men,Брюки,Хлопковые летние брюки карго,1229
wildberries,FUNDAY,Men,Брюки,Брюки хлопковые с резинкой и завязками демисезонные,852
wildberries,бинь бинь,Men,Брюки,Джинсовые брюки прямые,1305
wildberries,DITE,Men,Брюки,Брюки летние льняные,5576
wildberries,MAGNUM laboratory,Men,Брюки,Черные брюки джоггеры с манжетами и лямками,3562
wildberries,PijonStyle,Men,Брюки,Спортивные штаны прямые с лампасами 90х,2231
wildberries,tellson,Men,Брюки,Спортивные штаны плащевые на сетке Россия,1910
wildberries,Black Star Original,Men,Брюки,Брюки джоггеры карго на резинке,2958
wildberries,Luxor,Men,Брюки,Брюки льняные прямые Турция,3922
wildberries,Mars Wear,Men,Брюки,Брюки Карго,3253
wildberries,Nike,Men,Брюки,Широкие спортивные штаны с начесом,1044
wildberries,Sharq,Men,Брюки,Штаны спортивные,962
wildberries,01БМ,Men,Брюки,Спортивные штаны,1161
wildberries,КомфортоЗ,Men,Брюки,Спортивные штаны,638
wildberries,SoftHome,Men,Брюки,Брюки,765
wildberries,DailyShine,Men,Брюки,Штаны широкие,1611
wildberries,Starkids,Men,Брюки,Брюки спортивные подростковые,515
wildberries,OUTFITZ,Men,Брюки,Брюки классические прямые в офис,1925
wildberries,Style Driven,Men,Брюки,Брюки со стрелками классические широкие бананы оверсайз,1923
wildberries,HappyFox,Men,Брюки,Штаны спортивные джоггеры хлопковые,942
wildberries,VipDressCode,Men,Брюки,Брюки спортивные широкие джоггеры афганки,2382
wildberries,,Men,Брюки,Брюки спортивные штаны джоггеры мужские,515
wildberries,ТВОЕ,Men,Брюки,Утепленные прямые брюки с надписью и начесом,962
wildberries,Макс-Экстрим,Men,Брюки,Брюки серые мужские штаны трикотажные с принтом на манжетах,1381
wildberries,Modjimoda,Men,Брюки,брюки джоггеры мужские спортивные круглогодичные,711
wildberries,SS_BIGMAN,Men,Брюки,Брюки классические большой размер,4475
wildberries,Bilionare sworld,Men,Брюки,Брюки вельветовые бананы на шнурке,2961
wildberries,PAOLO MARNI,Men,Брюки,Брюки классические повседневные в офис S - XXXL,1882
wildberries,Maverick Mode,Men,Брюки,Спортивные брюки с полосками,1462
wildberries,Mark Formelle,Men,Брюки,Брюки спортивные джоггеры без начеса,2902
wildberries,Ticle,Men,Брюки,Брюки джоггеры без начеса,1492
wildberries,ИП Аманова,Men,Брюки,Мужские спортивные штаны на манжете х б,775
wildberries,lacoste,Men,Брюки,Брюки спортивные Slim fit из хлопка и флиса,9959
wildberries,MOR.,Men,Брюки,Брюки спортивные штаны спортивные,819
wildberries,Golden_Calf,Men,Брюки,Брюки спортивные повседневные джоггеры,1378
wildberries,Golden_Calf,Men,Брюки,Брюки спортивные широкие джоггеры,2149
wildberries,Mark Formelle,Men,Брюки,Брюки спортивные джоггеры,2902
wildberries,Макс-Экстрим,Men,Брюки,Брюки мужские хаки трикотажные с принтом домашние,1381
wildberries,Stil-Men,Men,Брюки,Спортивные штаны джоггеры,879
wildberries,MKORNY,Men,Брюки,Вельветовые брюки y2k парашют широкие карго drill,1849
wildberries,ТВОЕ,Men,Брюки,Широкие брюки парашюты,2776
wildberries,ТВОЕ,Men,Брюки,Широкие брюки карго на резинке с боковыми карманами,1102
wildberries,Sharq,Men,Брюки,Штаны спортивные,927
wildberries,Starkids,Men,Брюки,Брюки спортивные подростковые,584
wildberries,Stil-Men,Men,Брюки,Штаны зимние теплый начес флис,1168
wildberries,B4M,Men,Брюки,Брюки свободные оверсайз багги широкие,1662
wildberries,Gailler,Men,Брюки,Костюм домашний Пижама со штанами хлопковая,1282
wildberries,ТВОЕ,Men,Брюки,Повседневные прямые брюки,1285
wildberries,VIRTA,Men,Брюки,Штаны спортивные широкие летние,1788
wildberries,JOGGBERRY,Men,Брюки,Брюки джоггеры спортивные на резинке,2507
wildberries,adidas,Men,Брюки,"Спортивные штаны, спортивные брюки",991
wildberries,KENSPRIT,Men,Брюки,Джинсы джоггеры штаны бананы широкие,2993
wildberries,JOGGBERRY,Men,Брюки,Брюки джоггеры классические синие,2551
wildberries,HITFORMA,Men,Брюки,Брюки мужские джоггеры штаны карго,
wildberries,street spirit,Men,Брюки,Брюки повседневные базовые джоггеры с карманами карго,2765
wildberries,JELEOS,Men,Брюки,Брюки классические на резинке бананы прямые зауженные,3057
wildberries,Fine Joyce,Men,Брюки,Брюки классические прямые лен,2873
wildberries,lacoste,Men,Брюки,Брюки спортивные флис Regular Fit,11224
wildberries,MIRROKU,Men,Брюки,Джинсы прямые широкие трубы,2782
wildberries,ТВОЕ,Men,Брюки,Утепленные брюки джоггеры с начесом,1222
wildberries,GANT,Men,Брюки,Брюки свободного кроя,10933
wildberries,PAOLO MARNI,Men,Брюки,Брюки классические повседневные в офис S - XXXL,1831
wildberries,Westrenger,Men,Брюки,Брюки чинос классические прямые,2339
wildberries,,Men,Брюки,Спортивные штаны прямые домашние,722
wildberries,GANZEL,Men,Брюки,Брюки летние льняные свободные,6879
wildberries,D13,Men,Брюки,Брюки джоггеры,1650
wildberries,Shishka,Men,Брюки,Широкие спортивные брюки оверсайз на резинке,3069
wildberries,Kristian White,Men,Брюки,Брюки широкие трубы прямые оверсайз,1890
wildberries,ПромДизайн,Men,Брюки,Брюки рабочие мужские зимние,1176
wildberries,GRAFFIX,Men,Брюки,Брюки карго прямые широкие с карманами,1796
wildberries,KOTON,Men,Брюки,Брюки,1399
wildberries,одежда по карману,Men,Брюки,Брюки домашние,427
wildberries,FULLA MODA,Men,Брюки,Брюки классические прямые,1560
wildberries,HITFORMA,Men,Брюки,Брюки мужские спортивные джоггеры штаны,1788
wildberries,MARYELLE,Men,Брюки,Брюки спортивные,2265
wildberries,MARYELLE,Men,Брюки,Спортивные штаны джоггеры широкие оверсайз,2353
wildberries,HypeSpot,Men,Брюки,Спортивныe штаны оверсайз с карманами,2032
wildberries,Rich One,Men,Брюки,"03. Широкие штаны. Комфорт, который тебе нужен!",2062
wildberries,ABITI,Men,Брюки,Брюки летние 100% лен,4191
wildberries,lipkinof,Men,Брюки,Брюки классические прямые со стрелками,2873
wildberries,O'STIN,Men,Брюки,Брюки,1636
wildberries,OVERJOY,Men,Брюки,Штаны с полосками y2k,769
wildberries,RIERA,Men,Брюки,Брюки классические базовые,2923
wildberries,Luxor,Men,Брюки,Брюки джоггеры с карманами Турция,3856
wildberries,FUNDAY,Men,Брюки,Брюки,989
wildberries,O'STIN,Men,Брюки,Брюки карго широкие утеплённые на резинке,1399
wildberries,nidu,Men,Брюки,Классические брюки зауженные,1792
wildberries,GERREG,Men,Брюки,Брюки тактические на флисе softshell олива,1299
wildberries,HITFORMA,Men,Брюки,Брюки мужские джоггеры штаны карго,2017
wildberries,TOM TAILOR,Men,Брюки,Брюки,1772
wildberries,IvPROF group,Men,Брюки,Брюки рабочие спецодежда,654
wildberries,ShopWise,Men,Брюки,спортивные штаны мужские,1261
wildberries,HENDERSON,Men,Брюки,Брюки,6114
wildberries,PALM ANGELS,Men,Брюки,Спортивные штаны джоггеры,1123
wildberries,Ticle,Men,Брюки,Брюки палаццо мужские летние,1891
wildberries,LOVAN,Men,Брюки,Брюки карго широкие прямые с карманами y2k,1320
wildberries,HITFORMA,Men,Брюки,Брюки мужские спортивные джоггеры штаны карго,
wildberries,DLVAXTY,Men,Брюки,Брюки прямые на резинке без стрелок,1803
wildberries,Shaptall,Men,Брюки,Спортивные штаны без начеса,764
wildberries,Ludi,Men,Брюки,Брюки бананы со стрелками классические широкие,3653
wildberries,OUTFITZ,Men,Брюки,Брюки классические широкие оверсайз,1994
wildberries,MARYELLE,Men,Брюки,Спортивные штаны прямые на резинке с карманами,1549
wildberries,TodoModa,Men,Брюки,Спортивные штаны джоггеры утепленные,1872
wildberries,,Men,Брюки,Вельветовые брюки,2445
wildberries,ModNeo,Men,Брюки,Брюки спортивные джоггеры,2049
wildberries,Nike,Men,Брюки,брюки,1264
wildberries,ОРЧИД ТЕКСТИЛЬ,Men,Брюки,Штаны спортивные джоггеры футер без начеса,775
wildberries,Dangel,Men,Брюки,Спортивные штаны мужские широкие оверсайз,3637
wildberries,swift sports,Men,Брюки,Спортивные штаны мужские брюки джоггеры на резинке,1467
wildberries,DORTMUND,Men,Брюки,Брюки чиносы классические прямые,3527
wildberries,Rich One,Men,Брюки,"03. Широкие штаны. Комфорт, который тебе нужен!",2112
wildberries,Nike,Men,Брюки,Спортивные брюки оверсайз,1375
wildberries,ZAGAZZO,Men,Брюки,Брюки свободные бананы на шнурках Турция,2521
wildberries,Алимода,Men,Брюки,Спортивные штаны свободные без начеса,671
wildberries,Jogger Street,Men,Брюки,Джоггеры штаны карго,3038
wildberries,MIRROKU,Men,Брюки,Джинсы широкие трубы прямые,2981
wildberries,BIG HILL,Men,Брюки,Брюки больших размеров утепленные на резинке,2675
wildberries,KALEN,Men,Брюки,Брюки джоггеры черные,2402
wildberries,Скромные будни,Men,Брюки,Спортивные прямые штаны оверсайз на лето,
wildberries,Dangel,Men,Брюки,Спортивные штаны оверсайз Широкие джоггеры на резинке,2086
wildberries,Luxor,Men,Брюки,Брюки чиносы классические Турция,3457
wildberries,TRUE BALANCE,Men,Брюки,Брюки мужские прямые спортивные летние,1253
wildberries,Nouvelle Vague,Men,Брюки,Брюки зауженные Турция,2663
wildberries,S.AMA,Men,Брюки,Брюки карго мужские,1087
wildberries,Kulibili,Men,Брюки,Вельветовые широкие штаны y2k у2к,2407
wildberries,Nike,Men,Брюки,Спортивные штаны мужские трико оверсайз,1299
wildberries,KRUTVERT,Men,Брюки,Без начеса штаны трикотажные серые джоггеры,2247
wildberries,Termit,Men,Брюки,Брюки,1596
wildberries,IGELEK,Men,Брюки,Брюки бананы со стрелками классические широкие,1682
wildberries,Mountain High,Men,Брюки,Брюки y2k широкие летние,2025
wildberries,CHELEBI,Men,Брюки,Челеби-Текстиль,1141
wildberries,Ticle,Men,Брюки,Брюки палаццо мужские летние,2063
wildberries,BENIR,Men,Брюки,Брюки спортивные зауженные cо стрелками,2501
wildberries,Top Master,Men,Брюки,Брюки бананы на резинке со стрелками укороченные,1589
wildberries,John&Costa,Men,Брюки,Спортивные брюки широкие со стрелками 03,3229
wildberries,STENSER,Men,Брюки,Брюки классические прямые,2750
wildberries,MCL,Men,Брюки,Брюки на резинке Турция летние,4292
wildberries,Ludi,Men,Брюки,Брюки бананы классические широкие,3506
wildberries,PijonStyle,Men,Брюки,Спортивные штаны из плащевки утепленные на флисе,2366
wildberries,UZcotton,Men,Брюки,Брюки черные на манжете с начесом,1096
wildberries,WiWin,Men,Брюки,"Джоггеры, брюки карго с ремнем",3248
wildberries,MAYZONT,Men,Брюки,Штаны широкие утепленные зимние,1450
wildberries,MAD Man,Men,Брюки,Брюки классические,2567
wildberries,GIN SHOP,Men,Брюки,Штаны спортивные летние джоггеры,1421
wildberries,MOR.,Men,Брюки,Штаны мужские спортивные,869
wildberries,INWN,Men,Брюки,Вельветовые штаны широкие,2017
wildberries,SELA,Men,Брюки,Брюки джоггеры карго со средней посадкой,771
wildberries,SoftHome,Men,Брюки,Брюки,740
wildberries,Nouvelle Vague,Men,Брюки,брюки классические офисные теплые,2315
wildberries,Outfit4Man,Men,Брюки,Брюки классические прямые,2245
wildberries,qhuse,Men,Брюки,Брюки со стрелками,3321
wildberries,Dangel,Men,Брюки,Спортивные штаны широкие мужские оверсайз,1719
wildberries,ПЛЮСВАЙБ,Men,Брюки,Штаны оверсайз спортивные,2726
wildberries,Capaalii,Men,Брюки,Штаны спортивные джоггеры повседневные,1611
wildberries,Kulibili,Men,Брюки,Брюки широкие вельветовые y2k парашют карго drill,1223
wildberries,ТВОЕ,Men,Брюки,Прямые джинсовые брюки,1072
wildberries,ValMay,Men,Брюки,Штаны домашние пижамные,977
wildberries,,Men,Брюки,Брюки мужские утепленные зимние на флисе,687
wildberries,HK,Men,Брюки,Спортивные штаны джоггеры с начесом,1309
wildberries,IvPROF group,Men,Брюки,Брюки рабочие мужские рыболовные,542
wildberries,INGDROP,Men,Брюки,Спортивные штаны прямые без манжета,1933
wildberries,Westrenger,Men,Брюки,Брюки чиносы классические прямые,4072
wildberries,adidas,Men,Брюки,Брюки,1296
wildberries,Dangel,Men,Брюки,Спортивные штаны оверсайз Широкие джоггеры на резинке,1528
wildberries,MR BIGMAN,Men,Брюки,Брюки спортивные джоггеры теплые с начесом большие размеры,1123
wildberries,MLS 883,Men,Брюки,Штаны спортивные утепленные на флисе Джоггеры,2133
wildberries,CEVAT’S,Men,Брюки,Брюки спортивные больших размеров,1124
wildberries,OUTFITZ,Men,Брюки,Брюки классические прямые в офис,1650
wildberries,TodoModa,Men,Брюки,Спортивные штаны джоггеры,1421
wildberries,ROVIO,Men,Брюки,Спортивные широкие штаны джоггеры оверсайз,2308
wildberries,MAYZONT,Men,Брюки,Брюки укороченные легкие широкие бананы,996
wildberries,SELA,Men,Брюки,Брюки классические со средней посадкой,1230
wildberries,MYNOT,Men,Брюки,Широкие спортивные брюки шаровары парашюты y2k,3348
wildberries,Pants-R,Men,Брюки,Брюки спортивные,1605
wildberries,PIAGIO,Men,Брюки,Широкие брюки на резинке хлопок,3276
wildberries,Kristian White,Men,Брюки,Брюки бананы широкие оверсайз трубы,1890
wildberries,Westrenger,Men,Брюки,Брюки классические прямые Турция,2085
wildberries,qhuse,Men,Брюки,Брюки бананы бежевые со шнурками,3645
wildberries,ARVADOR,Men,Брюки,Брюки карго джоггеры,1728
wildberries,POL’MOTIVE,Men,Брюки,Спортивные брюки утепленные джоггеры с начесом,1436
wildberries,Next Station,Men,Брюки,Штаны прямые широкие оверсайз на резинке для подростков,2101
wildberries,AnMin,Men,Брюки,Брюки чиносы классические прямые,2102
wildberries,Alteza,Women,Брюки,"брюки, легинсы утепленные женские клеш от колена в рубчик",962
wildberries,,Women,Брюки,Брюки бананы трикотажные укороченные 7 8 на резинке,1681
wildberries,ТВОЕ,Women,Брюки,Широкие брюки бананы с заниженной талией,1013
wildberries,Brostem,Women,Брюки,брюки трикотажные на резинке,1535
wildberries,ТВОЕ,Women,Брюки,Классические брюки клеш от бедра,804
wildberries,Que?,Women,Брюки,Брюки классические,2063
wildberries,ТВОЕ,Women,Брюки,Классические повседневные прямые брюки Plus Size,832
wildberries,Bee Happy,Women,Брюки,Брюки классические прямые на резинке,2001
wildberries,Bergamogatto,Women,Брюки,Джинсы широкие багги wide leg со средней посадкой,3337
wildberries,ТВОЕ,Women,Брюки,Прямые джинсовые брюки,1727
wildberries,New Life jersey,Women,Брюки,Спортивные штаны теплые джоггеры,1524
wildberries,Gloria Jeans,Women,Брюки,Серые спортивные брюки Straight с лампасами,2578
wildberries,SoDatrend,Women,Брюки,Брюки классические на резинке укороченные 7-8,2149
wildberries,ТВОЕ,Women,Брюки,Брюки прямые классические,774
wildberries,FADJO,Women,Брюки,Брюки палаццо классические,2108
wildberries,WITH STREET,Women,Брюки,Брюки кюлоты летние больших размеров,1485
wildberries,ТВОЕ,Women,Брюки,Брюки в стиле y2k с орнаментом и начесом,1230
wildberries,MELANA,Women,Брюки,Брюки белые спортивные стрейч трико фитнес,1100
