Marketplace,Brand,Gender,SearchQuery,ProductName,Price
wildberries,Befree,Men,Джинсы,Джинсы прямые укороченные со средней посадкой,1635
wildberries,PLANETA JEANS,Men,Джинсы,Джинсы мужские утепленные с начесом на флисе зимние прямые,2283
wildberries,fluency 2.0,Men,Джинсы,Джинсы багги широкие y2k sk8,3985
wildberries,SUPER SHIP JEANS,Men,Джинсы,Джинсы мужские утепленные с начесом на байке,2474
wildberries,FUGUMI,Men,Джинсы,Джинсы багги y2k трубы широкие прямые потертые,2445
wildberries,MAROV,Men,Джинсы,Джинсы багги широкие,3053
wildberries,BREISKA,Men,Джинсы,Джинсы прямые утепленные большие размеры,1925
wildberries,,Men,Джинсы,Джинсы классические,3577
wildberries,SUPER PERRY'S,Men,Джинсы,Джинсы классические прямые,4453
wildberries,TONY BACKER,Men,Джинсы,Джинсы скинни зауженные средняя посадка,1418
wildberries,Evisu,Men,Джинсы,Джинсы широкие,3321
wildberries,ESSE PRIMUM,Men,Джинсы,Джинсы прямые классические,3508
wildberries,Bedew,Men,Джинсы,Джинсы зауженные к низу стрейч,2321
wildberries,DENIMAN,Men,Джинсы,Джинсы бананы зауженные к низу мом,2544
wildberries,Handmader,Men,Джинсы,Джинсы мужские классические,2407
wildberries,PIAGIOLINI,Men,Джинсы,Джинсы прямые широкие классика,1146
wildberries,Umaro,Men,Джинсы,Джинсы бананы на резинке,1180
wildberries,KOTON,Men,Джинсы,Джинсы,1314
wildberries,Mark Formelle,Men,Джинсы,Джинсы синие прямые классические,2395
wildberries,ТВОЕ,Men,Джинсы,Классические широкие слегка зауженные джинсы,2056
wildberries,Zolla,Men,Джинсы,Джинсы облегающего силуэта,1650
wildberries,nord fenix,Men,Джинсы,Джинсы бананы прямые зауженные к низу,1166
wildberries,ТВОЕ,Men,Джинсы,Зауженные классические джинсы,1340
wildberries,BroJeans,Men,Джинсы,Джинсы бананы широкие,2092
wildberries,Colin's,Men,Джинсы,Джинсы скинни 035 RYAN Skinny Fit,2031
wildberries,VETASAP,Men,Джинсы,Джинсы мужские прямые классические синие,2459
wildberries,Великоросс,Men,Джинсы,Классические джинсы из натурального 100% хлопка,8820
wildberries,JACO KORSS,Men,Джинсы,Джинсы зауженные к низу стрейч,1858
wildberries,SUPER SHIP JEANS,Men,Джинсы,Джинсы мужские классические прямые,2923
wildberries,,Men,Джинсы,Джинсы бананы зауженные мом,2675
wildberries,Modaleto,Men,Джинсы,Джинсы слим прямые зауженные классические момы,1233
wildberries,SkyenSon,Men,Джинсы,Джинсы зауженные прямые синие скинни Турция,2108
wildberries,PEPE JEANS LONDON,Men,Джинсы,Джинсы зауженные синие с подворотами,3191
wildberries,FUGUMI,Men,Джинсы,Джинсы багги y2k трубы широкие прямые,2383
wildberries,FUNDAY,Men,Джинсы,Джинсы прямые зауженные демисезонные на молнии,971
wildberries,MASSI,Men,Джинсы,Джинсы мужские классические,2835
wildberries,MKJeans,Men,Джинсы,Джинсы зауженные к низу стрейч,3629
wildberries,minimalism teen,Men,Джинсы,Джинсы широкие багги трубы прямые,2384
wildberries,Koutons,Men,Джинсы,Джинсы прямые,3095
wildberries,BroWear,Men,Джинсы,джинсы багги широкие трубы прямые оверсайз y2k,2782
wildberries,CATCHY GLITCH,Men,Джинсы,Джинсы багги широкие sk8 баллоны y2k оверсайз,2609
wildberries,T.ONE SYMBOL,Men,Джинсы,Джинсы утепленные на флисе,1757
wildberries,BOTON,Men,Джинсы,Прямые джинсы классические,3545
wildberries,Мяготь,Men,Джинсы,Джинсы бананы хлопковые,3026
wildberries,ДоШоп,Men,Джинсы,Джинсы легкие больших размеров на резинке,1529
wildberries,Zolla,Men,Джинсы,Джинсы зауженного силуэта,1863
wildberries,Eremes,Men,Джинсы,Джинсы прямые классические,2637
wildberries,motivate,Men,Джинсы,Джинсы широкие клеш y2k,3536
wildberries,Discrete,Men,Джинсы,Джинсы классические летние,4493
wildberries,SIXTH LEGEND,Men,Джинсы,Джинсы прямые утепленные классические на флисе,2269
wildberries,Colin's,Men,Джинсы,Джинсы скинни 040 ALEX Skinny Fit,2405
wildberries,KRAPIVA,Men,Джинсы,джинсы широкие классические зауженные,6423
wildberries,"SAJ ARNOLD,MaxQ,RUS-BARON,CORINOO,MOCK-UPJEANS",Men,Джинсы,Джинсы прямые классические Турция,3094
wildberries,DEKON'S,Men,Джинсы,Джинсы больших размеров Деконс 2043,4892
wildberries,MASSIMO URBANO,Men,Джинсы,Джинсы прямые классические,2257
wildberries,HOP Fashions,Men,Джинсы,Джинсы бананы на завязках,1886
wildberries,O'STIN,Men,Джинсы,Джинсы зауженные на молнии,930
wildberries,Cristilisa Shop,Men,Джинсы,Джинсы широкие бананы на резинке,2935
wildberries,Shemberg&LR,Men,Джинсы,Джинсы прямые классические Турция,1918
wildberries,FUGUMI,Men,Джинсы,Джинсы багги y2k трубы широкие прямые,1711
wildberries,Dime,Men,Джинсы,Джинсы широкие трубы прямые,3255
wildberries,STEZI,Men,Джинсы,Потертые джинсы y2k широкие,1508
wildberries,O'STIN,Men,Джинсы,Джинсы хлопковые на молнии,1322
wildberries,O'STIN,Men,Джинсы,Джинсы классические зауженные,1652
wildberries,Befree,Men,Джинсы,Джинсы loose fit со средней посадкой,1910
wildberries,SIХТН Legend,Men,Джинсы,Джинсы утепленные зауженные,2151
wildberries,MOSSMORE,Men,Джинсы,Джинсы прямые утепленные с начесом широкие штаны зимние,2407
wildberries,ONEBILLIONE,Men,Джинсы,Джинсы широкие трубы,2323
wildberries,Armani Jeans,Men,Джинсы,Джинсы,4242
wildberries,STRAVT THE DENIM,Men,Джинсы,Джинсы мужские мом,2442
wildberries,Carlo space,Men,Джинсы,Прямые джинсы классические,3912
wildberries,Lee,Men,Джинсы,Джинсы,4100
wildberries,Gloria Jeans,Men,Джинсы,Серые джинсы Easy fit с эластичным поясом,3897
wildberries,Trendy Solutions,Men,Джинсы,Джинсы зауженные с потертостями Турция,3424
wildberries,KENBEY,Men,Джинсы,Джинсы прямые классические больших размеров Турция,2521
wildberries,Befree,Men,Джинсы,Джинсы-бананы со средней посадкой,2141
wildberries,Dime,Men,Джинсы,Джинсы широкие,2348
wildberries,VIKING company group,Men,Джинсы,Джинсы зауженные брюки джоггеры штаны на резинке с карманами,1160
wildberries,PAGALEE JEANS,Men,Джинсы,Джинсы прямые классические,2675
wildberries,Без бренда,Men,Джинсы,Джинсы широкие бананы,2080
wildberries,WANNA CHICCA,Women,Джинсы,Джинсы скинни с высокой посадкой зауженные стрейч пуш-ап,1196
wildberries,Tsymlyanskaya,Women,Джинсы,Джинсы с высокой посадкой трубы прямые,1833
wildberries,DDU,Women,Джинсы,Джинсы бананы мом с высокой посадкой,1918
wildberries,K&DD wmn,Women,Джинсы,Джинсы широкие трубы для невысоких школьные,1283
wildberries,RADISH,Women,Джинсы,Джинсы прямые большие размеры на резинке,
wildberries,TAGCLO,Women,Джинсы,Джинсы двухцветные прямые с разрезами,2519
wildberries,FEIMAILIS,Women,Джинсы,Джинсы широкие клеш палаццо,3184
wildberries,LAFEI-NIER,Women,Джинсы,Джинсы,2063
wildberries,ZORA,Women,Джинсы,Джинсы прямые стрейч зауженные с высокой посадкой,1764
wildberries,Hola,Women,Джинсы,Джинсы прямые Mom fit на осень со средней посадкой,1312
wildberries,ROCKBABE,Women,Джинсы,Джинсы широкие багги y2k,2862
wildberries,VIGOSS,Women,Джинсы,Джинсы прямые с высокой посадкой Турция,2521
wildberries,Denim&A,Women,Джинсы,Джинсы с высокой посадкой мом бананы прямые скинни,2375
wildberries,OLTI,Women,Джинсы,Джинсы багги широкие большие размеры,1857
wildberries,WESTCAT,Women,Джинсы,Джинсы бананы,1642
wildberries,FEIMAILIS,Women,Джинсы,Джинсы прямые с высокой посадкой трубы,2283
wildberries,Vill Van,Women,Джинсы,Джинсы МОМ на резинке утепленные на байке на зиму,1200
wildberries,Eiland,Women,Джинсы,Джинсы широкие голубые стрейч,3424
wildberries,Jeanger,Women,Джинсы,Джинсы широкие винтаж y2k,3198
wildberries,STEZI,Women,Джинсы,Потертые джинсы y2k широкие,2382
wildberries,Lisar,Women,Джинсы,Джинсы прямые широкие трубы с высокой посадкой серые,1506
wildberries,Koutons,Women,Джинсы,Джинсы женские мом бананы,779
wildberries,T&T JEANS - LOLOBLUES,Women,Джинсы,Джинсы бананы высокая посадка прямые mom LOLOBLUES,1986
wildberries,Befree,Women,Джинсы,Джинсы baggy fit со средней посадкой,2869
wildberries,LUCIANO EXCELLENCE,Women,Джинсы,Джинсы прямые широкие трубы стрейч,2283
wildberries,Gee30,Women,Джинсы,Скинни джинсы с высокой посадкой зауженные стрейч,1265
wildberries,REENSKO,Women,Джинсы,Джинсы скинни серые с высокой посадкой,
wildberries,EZZEVIKA,Women,Джинсы,Джинсы багги y2k с высокой посадкой,2522
wildberries,Zolla,Women,Джинсы,Женские джинсы Boyfriend с бахромой,1764
wildberries,Мода-А,Women,Джинсы,Джинсы однотонные на резинке y2k,1679
wildberries,Cагас,Women,Джинсы,Джинсы комбинированные хлопок необработанный деним,867
wildberries,SELA,Women,Джинсы,Джинсы 410 WIDE LEG,1960
wildberries,LADY NICE,Women,Джинсы,джинсы широкие трубы прямые палаццо,3826
wildberries,Bang Wear,Women,Джинсы,Джинсы широкие багги y2k,2247
wildberries,Zsimple,Women,Джинсы,Джинсы бананы с высокой посадкой на резинке светлые,1232
wildberries,CC HOME,Women,Джинсы,Прямые джинсы классические на высокой посадке,2912
wildberries,СмелыйМаркет,Women,Джинсы,Джинсы широкие клеш с высокой посадкой,1735
wildberries,ALEKSA,Women,Джинсы,Джинсы на резинке большие размеры,2396
wildberries,AleeJeans,Women,Джинсы,Джинсы клеш трубы прямые,1291
wildberries,MIRROKU,Women,Джинсы,Джинсы широкие Baggy y2k,3152
wildberries,INTVOICE,Women,Джинсы,Джинсы леопардовые прямые свободного кроя,1258
wildberries,Jonny Style,Women,Джинсы,Джинсы трубы палаццо,1872
wildberries,Romantic_Denim,Women,Джинсы,Джинсы трубы женские,2717
wildberries,REENSKO,Women,Джинсы,Джинсы прямые трубы с высокой посадкой,1571
wildberries,3DKOT,Women,Джинсы,Джинсы широкие оверсайз трубы с высокой посадкой,2261
wildberries,ТВОЕ,Women,Джинсы,Широкие классические джинсы оверсайз,2537
wildberries,SennOff,Women,Джинсы,Джинсы трубы,2235
wildberries,D2Jeans,Women,Джинсы,Джинсы широкие клеш с высокой посадкой,3477
wildberries,Fine Joyce,Women,Джинсы,Джинсы прямые утепленные зимние на флисе,1901
wildberries,VARSIK,Women,Джинсы,Джинсы клеш трубы прямые,1291
wildberries,Mark Formelle,Women,Джинсы,Джинсы Mom fit с высокой посадкой,3081
wildberries,S.R.S JEANS,Women,Джинсы,Джинсы скинни с высокой посадкой,1726
wildberries,Papa Jeans,Women,Джинсы,Джинсы прямые широкие трубы с высокой посадкой,3508
wildberries,Stylers,Women,Джинсы,Джинсы широкие багги y2k потертые,3110
wildberries,AmiEm,Women,Джинсы,"Джинсы широкие, трубы, прямые",3592
wildberries,Sam Alex’s Jeans,Women,Джинсы,Джинсы скинни женские с высокой посадкой,1109
wildberries,NICEJEANS,Women,Джинсы,Джинсы клеш от колена синие,2063
wildberries,Воздушная Овечка,Women,Джинсы,Джинсы бананы синие на резинке,1728
wildberries,ETERNAL FLAME,Women,Джинсы,Джинсы больших размеров прямые на резинке высокая посадка,4031
wildberries,BULKI,Women,Джинсы,Прямые джинсы мом с высокой посадкой,3198
wildberries,Brand Illusion,Women,Джинсы,Джинсы трубы прямые широкие клеш,1772
wildberries,W.ONE,Women,Джинсы,Джинсы широкие палаццо,2643
wildberries,FEIMAILIS,Women,Джинсы,Джинсы прямые с высокой посадкой стрейч,2742
wildberries,,Women,Джинсы,Джинсы широкие Багги синие y2k,2622
wildberries,MONEOLA,Women,Джинсы,Джинсы трубы палаццо прямые,2958
wildberries,WHITNEY,Women,Джинсы,Джинсы клеш с высокой посадкой широкие облегченные,4544
wildberries,Nadi Bordo,Women,Джинсы,Джинсы оверсайз широкие багги потертые,3485
wildberries,Jeans Balance,Women,Джинсы,Джинсы бананы мом с высокой посадкой,2702
wildberries,MiMo Beauty,Women,Джинсы,Джинсы мом с высокой посадкой,2145
wildberries,VICO JEANS,Women,Джинсы,Джинсы клеш высокая посадка,1900
wildberries,Easy Chic,Women,Джинсы,Джинсы широкие прямые трубы,2438
wildberries,Brand Illusion,Women,Джинсы,Джинсы трубы прямые широкие клеш,1987
wildberries,Shymberg,Women,Джинсы,Джинсы мом с высокой посадкой,1834
wildberries,Gloria Jeans,Women,Джинсы,Серые джинсы Easy fit на резинке,2750
wildberries,BlueChic,Women,Джинсы,Прямые джинсы мом с высокой посадкой,1918
wildberries,ИП Гладких,Women,Джинсы,Джинсы прямые трубы с высокой посадкой,1601
wildberries,oodji,Women,Джинсы,Джинсы skinny со средней посадкой,1313
wildberries,Denim&A,Women,Джинсы,Джинсы с высокой посадкой мом бананы прямые скинни,2431
wildberries,Zolla,Women,Джинсы,Женские джинсы Boyfriend с поясом,2032
wildberries,Blinx,Women,Джинсы,Джинсы широкие прямые трубы y2k оверсайз багги,2253
wildberries,ZDN jeans,Women,Джинсы,Джинсы металлик прямые клеш,2182
wildberries,OSNOVA,Women,Джинсы,Джинсы трубы широкие утепленные,1925
wildberries,Brand Illusion,Women,Джинсы,Джинсы скинни с высокой посадкой зауженные стрейч,1444
wildberries,EUROMAMA,Women,Джинсы,Джинсы для беременных мом высокая посадка,2292
wildberries,Eucalipto,Women,Джинсы,Джинсы клеш,2204
wildberries,Anna Tsurkan jeans,Women,Джинсы,Джинсы клеш синие,2338
wildberries,Three&N,Women,Джинсы,Джинсы вельветовые джоггеры на резинке большие размеры,2370
wildberries,KOTON,Women,Джинсы,Джинсы,1139
wildberries,SELA,Women,Джинсы,Джинсы 495 SKINNY FIT,1950
wildberries,MONEOLA,Women,Джинсы,Джинсы кюлоты прямые,2958
wildberries,ИП Гергарт,Women,Джинсы,Джинсы трубы прямые клеш,1879
wildberries,Befree,Women,Джинсы,Джинсы оверсайз широкие,2095
wildberries,PRAISEJEANS,Women,Джинсы,Джинсы бананы с высокой посадкой укороченные мом скинни,1140
wildberries,,Women,Джинсы,Джинсы широкие утепленные на высокой посадке,2261
wildberries,ZARINA,Women,Джинсы,Джинсы wide leg с высокой посадкой,2747
wildberries,Hola,Women,Джинсы,Джинсы палаццо женские широкие,1619
wildberries,Befree,Women,Джинсы,Джинсы barrel fit со средней посадкой,1542
wildberries,Salendo,Women,Джинсы,Джинсы мом с высокой посадкой классические,3162
wildberries,ELVIN SHOP,Women,Джинсы,Джинсы трубы палаццо,2108
wildberries,FEIMAILIS,Women,Джинсы,Джинсы широкие прямые трубы,2530
wildberries,Black Dragon,Women,Джинсы,Джинсы широкие женские черные трубы высокая посадка,980
wildberries,Victoria Ondar,Women,Джинсы,Джинсы широкие багги прямые,3601
wildberries,VIVAWOOL,Women,Джинсы,Джинсы прямые большие размеры,2120
wildberries,VICO JEANS,Women,Джинсы,Джинсы прямые широкие,1941
wildberries,KRISTAR,Women,Джинсы,Джинсы женские бойфренды МОМ турция,1511
wildberries,TISHKA JEANS,Women,Джинсы,Джинсы широкие прямые y2k,2567
wildberries,Orhida,Women,Джинсы,Джинсы бананы на резинке момы,1467
wildberries,Мода-А,Women,Джинсы,Джинсы на резинке однотонные,1729
wildberries,TINASA,Women,Джинсы,Джинсы скинни,1273
wildberries,Bergamogatto,Women,Джинсы,Леопардовые джинсы багги,2531
wildberries,Trégo,Women,Джинсы,Джинсы прямые больших размеров,2637
wildberries,Truthful,Women,Джинсы,Джинсы мом бананы,1329
wildberries,MissForm,Women,Джинсы,Джинсы прямые трубы широкие,2242
wildberries,Мода-А,Women,Джинсы,Джинсы на резинке,1698
wildberries,Befree,Women,Джинсы,Джинсы широкие с высокой посадкой,2129
wildberries,LAMINIA,Women,Джинсы,Джинсы трубы на высокой посадке палаццо клеш,1764
wildberries,DS Moda,Women,Джинсы,Джинсы женские большие размеры,1781
wildberries,SELA,Women,Джинсы,Джинсы 404 MOM FIT,2057
wildberries,urbano mondo,Women,Джинсы,Джинсы прямые трубы высокая посадка,1373
wildberries,Bona Fide,Women,Джинсы,Джинсы клеш от колена с высокой посадкой голубые,6884
wildberries,Jeans Balance,Women,Джинсы,Джинсы бананы мом прямые с высокой посадкой,2518
wildberries,CUNOSS,Women,Джинсы,Джинсы мом с высокой посадкой Турция,4165
wildberries,ZORA JEANS,Women,Джинсы,Широкие джинсы черные трубы с высокой посадкой,2675
wildberries,Feliamo,Women,Джинсы,Джинсы с высокой посадкой на резинке,2259
wildberries,A-Shell,Women,Джинсы,Джинсы прямые трубы с высокой посадкой,2499
wildberries,JECCESS,Women,Джинсы,Джинсы с высокой посадкой бананы мом,1841
wildberries,ZARAZA,Women,Джинсы,Широкие джинсы трубы багги оверсайз,2154
wildberries,Bergamogatto,Women,Джинсы,Джинсы широкие багги baggy jeans,3139
wildberries,Anna Tsurkan jeans,Women,Джинсы,Джинсы прямые,2663
wildberries,L&F,Women,Джинсы,Джинсы широкие багги y2k прямые,3095
wildberries,Jeans Line,Women,Джинсы,Джинсы мом бананы с высокой посадкой зауженные,3473
wildberries,MARFAWOMEN,Women,Джинсы,Джинсы черные женские широкие прямые классические,3512
wildberries,SHINRAI,Women,Джинсы,Джинсы клеш прямые трубы широкие,4035
wildberries,ТВОЕ,Women,Джинсы,Свободные джинсы карго с боковыми карманами,1159
wildberries,GARRAD,Women,Джинсы,Джинсы мом с высокой посадкой укороченные,2369
wildberries,Mircada,Women,Джинсы,Джинсы бананы с высокой посадкой мом коричневые,2397
wildberries,KY.Denim,Women,Джинсы,Джинсы скинни с высокой посадкой зауженные стрейч,1386
wildberries,JOXANNA,Women,Джинсы,Джинсы женские клеш от колена прямые,1684
wildberries,Befree,Women,Джинсы,Джинсы клеш с тинтованным окрашиванием,1666
wildberries,Nefertiti,Women,Джинсы,Джинсы женские прямые классические,2407
wildberries,Nefertiti,Women,Джинсы,Джинсы женские с высокой посадкой Mom,2407
wildberries,,Women,Джинсы,Джинсы бананы большие размеры,2937
wildberries,StreetDNK,Women,Джинсы,Широкие джинсы багги,3615
wildberries,Orhida,Women,Джинсы,Джинсы трубы прямые широкие палаццо,2006
wildberries,Albicocca,Women,Джинсы,Прямые джинсы трубы с высокой посадкой,1817
wildberries,Befree,Women,Джинсы,Джинсы прямые со средней посадкой,1800
wildberries,FEIMAILIS,Women,Джинсы,Джинсы кюлоты укороченные,3178
wildberries,Roddar,Women,Джинсы,Джинсы женские широкие прямые клеш y2k трубы багги потертые,3228
wildberries,AR.KS line,Women,Джинсы,Джинсы мом с высокой посадкой стрейч зауженные mom,2348
wildberries,TimePortal_Styles,Women,Джинсы,Джинсы в стиле y2k с авторским дизайном baggy jeans,2140
wildberries,Dagny,Women,Джинсы,Джинсы широкие Dric,1849
wildberries,SangerStyle,Women,Джинсы,Джинсы классические прямые средняя посадка,2774
wildberries,BesameMucho,Women,Джинсы,Джинсы скинни с высокой посадкой большие размеры стрейч,
wildberries,TERFA,Women,Джинсы,Джинсы широкие с высокой посадкой,2202
wildberries,MIRODETTA,Women,Джинсы,Прямые джинсы женские трубы клеш,3097
wildberries,NIKKI LINE,Women,Джинсы,Джинсы широкие расклешенные,3546
wildberries,Befree,Women,Джинсы,Джинсы прямые с высокой посадкой,2424
wildberries,Lazer Fashion,Women,Джинсы,Джинсы стрейч на резинке джеггинсы,1142
wildberries,ТВОЕ,Women,Джинсы,Повседневные джинсы багги с вареным эффектом,1727
wildberries,BLUE COCO,Women,Джинсы,Джинсы клеш прямые,4119
