Marketplace,Brand,Gender,SearchQuery,ProductName,Price
wildberries,mjolk,Kids,Свитшот,Свитшот для девочки,1385
wildberries,Elementarno,Kids,Свитшот,Свитшот детский с принтом хлопок,582
wildberries,SELA,Kids,Свитшот,Свитшот из футера с принтом и эффектом стирки,883
wildberries,Likie,Kids,Свитшот,Свитшот (фуфайка с рукавом) для детей,538
wildberries,Little Lis,Kids,Свитшот,Свитшот для детей в полоску,1005
wildberries,KOTON,Kids,Свитшот,Свитшот,310
wildberries,Winkiki,Kids,Свитшот,Свитшот оверсайз с начесом,779
wildberries,ТК Трикотажный Континент,Kids,Свитшот,Лонгслив Юнармия футер без начеса,1444
wildberries,MODESTREET подростковая одежда,Kids,Свитшот,Свитшот детский подростковый для мальчика девочки оверсайз,1283
wildberries,Belkina,Kids,Свитшот,Свитшот детский толстовка на молнии,1070
wildberries,MODESTREET подростковая одежда,Kids,Свитшот,Свитшот детский подростковый для мальчика девочки оверсайз,1363
wildberries,Amelina Kids,Kids,Свитшот,Свитшот из хлопка,529
wildberries,SELA,Kids,Свитшот,Свитшот из футера с принтом хлопок,645
wildberries,sGs - Street Grange Style,Kids,Свитшот,Свитшот y2k оверсайз в гоночном стиле с принтом,1717
wildberries,CHELEBI,Kids,Свитшот,Челеби-Текстиль,548
wildberries,Amali.T,Kids,Свитшот,Свитшот для подростка с лампасами спортивный повседневный,587
wildberries,Стиляж,Kids,Свитшот,"Свитшот для мальчика, девочки модный стильный с принтом",1045
wildberries,LEO,Kids,Свитшот,Свитшот спортивный толстовка без начеса,746
wildberries,FORTYFOUR,Kids,Свитшот,Свитшот из футера Русалка Русалочка,2524
wildberries,RODINKA,Kids,Свитшот,Свитшот толстовка оверсайз,1916
wildberries,Winkiki,Kids,Свитшот,Свитшот оверсайз с начесом,675
wildberries,Timtim Shop,Kids,Свитшот,Свитшот детский базовый оверсайз,
wildberries,TemkaBoom,Kids,Свитшот,Свитшот с принтом,396
wildberries,Старт.,Kids,Свитшот,Свитшот,1404
wildberries,Касатка,Kids,Свитшот,Свитшот для мальчика,595
wildberries,Alir,Kids,Свитшот,Свитшот джемпер школьный без начеса,
wildberries,LEREDE,Kids,Свитшот,Свитшот оверсайз свободный,1265
wildberries,Kids.fm,Kids,Свитшот,Свитшот для малыша,931
wildberries,UZcotton,Kids,Свитшот,Свитшот зеленый детский с начесом,454
wildberries,SIDaha,Kids,Свитшот,Свитшот детский оверсайз,873
wildberries,ПОЛИДАША,Kids,Свитшот,Свитшот,375
wildberries,TemkaBoom,Kids,Свитшот,Свитшот с принтом,412
wildberries,Firefly_kids,Kids,Свитшот,Свитшот с принтом,935
wildberries,BODO,Kids,Свитшот,Свитшот оверсайз с воротником поло,2066
wildberries,BUNGLY,Kids,Свитшот,Свитшот детский облегченный в полоску,2021
wildberries,LEO,Kids,Свитшот,Свитшот спортивный толстовка без начеса,942
wildberries,A&E,Kids,Свитшот,Свитшот,1256
wildberries,E X P R E S S I O,Kids,Свитшот,Свитшот оверсайз толстовка спортивная джемпер школьный,770
wildberries,Lifeel,Kids,Свитшот,Свитшот без начеса для девочек и мальчиков.Толстовка детская,1031
wildberries,Momkiddy,Kids,Свитшот,Свитшот оверсайз подростковый,1027
wildberries,Старт.,Kids,Свитшот,Свитшот,1310
wildberries,WANEX,Kids,Свитшот,Свитшот кофта оверсайз,1695
wildberries,MIN MAX KIDS,Kids,Свитшот,свитшот для подростка,882
wildberries,Lifeel,Kids,Свитшот,Свитшот белый с начесом Толстовка для девочек и мальчиков,1306
wildberries,Jambo wear,Kids,Свитшот,Свитшот без начеса,1187
wildberries,TONY BABY,Kids,Свитшот,свитшот с принтом,857
wildberries,LikeAlice,Kids,Свитшот,Свитшот с принтом оверсайз,506
wildberries,DDVI,Kids,Свитшот,Свитшот детский базовый с начесом,409
wildberries,Селтекс,Kids,Свитшот,Свитшот детский толстовка оверсайз,642
wildberries,mjolk,Kids,Свитшот,Свитшот для мальчика и для девочки,1176
wildberries,Go dream,Kids,Свитшот,Свитшот Стич,1228
wildberries,Go dream,Kids,Свитшот,Свитшот с начесом Герб.Гарри Поттер,1266
wildberries,Generation NEXT,Kids,Свитшот,Свитшот оверсайз для подростка с принтом Bad-Good,1229
wildberries,mjolk,Kids,Свитшот,Свитшот для мальчика и для девочки,1809
wildberries,Little Pirates,Kids,Свитшот,Свитшот из футера Минни Маус,2643
wildberries,FORTYFOUR,Kids,Свитшот,"Свитшот из футера TieDye, Тай Дай",2524
wildberries,INZIBE,Kids,Свитшот,Свитшот утепленный с начесом детский,1638
wildberries,5+,Kids,Свитшот,Свитшот,350
wildberries,Селтекс,Kids,Свитшот,Свитшот оверсайз для мальчика подростковый,642
wildberries,Kids.fly,Kids,Свитшот,Свитшот детский оверсайз,1547
wildberries,LoveHoodies,Kids,Свитшот,свитшот,672
wildberries,Glamourchik,Kids,Свитшот,Свитшот детский Молодежь,1623
wildberries,LEO,Kids,Свитшот,Свитшот спортивный толстовка без начеса,765
wildberries,Hello kids,Kids,Свитшот,Свитшот спортивный с принтом худи,1169
wildberries,Lucky Child,Kids,Свитшот,Свитшот школьный детский с начесом оверсайз,1016
wildberries,Lunikids,Kids,Свитшот,Свитшот школьный утепленный для подростка,1526
wildberries,LAVINAS,Kids,Свитшот,Свитшот детский худи,1718
wildberries,EEkid,Kids,Свитшот,Свитшот для девочки теплая кофта детская,687
wildberries,Tanuki Kids,Kids,Свитшот,Свитшот для девочек и мальчиков,917
wildberries,BOO&LOO,Kids,Свитшот,Свитшот детский оверсайз,1261
wildberries,Малышка Ksu,Kids,Свитшот,свитшот детский с начесом,825
wildberries,h&M kids,Kids,Свитшот,Свитшот,1316
wildberries,Yasya baby,Kids,Свитшот,Свитшот детский,479
wildberries,StarKidsStyle,Kids,Свитшот,Свитшот школьный детский,670
wildberries,Lifeel,Kids,Свитшот,Свитшот без начеса подростковый Толстовка для детей,962
wildberries,Стиляж,Kids,Свитшот,"Свитшот для мальчика, девочки модный стильный с принтом",1337
wildberries,BeeKidZzz,Kids,Свитшот,свитшот для детей в садик,720
wildberries,Алимода,Kids,Свитшот,Свитшот базовый оверсайз без начеса для подростка,700
wildberries,UZcotton,Kids,Свитшот,Свитшот без начеса кофта летняя однотонная,352
wildberries,Касатка,Kids,Свитшот,Яркий свитшот без начеса,423
wildberries,BUNCODE,Kids,Свитшот,Базовый свитшот детский толстовка,
wildberries,Alir,Kids,Свитшот,Свитшот джемпер школьный без начеса,1629
wildberries,D&D STORE KIDS,Kids,Свитшот,Свитшот толстовка оверсайз подростковая,2407
wildberries,my FOX,Kids,Свитшот,Свитшот оверсайз свободная Толстовка,1952
wildberries,KIDSARIO,Kids,Свитшот,Свитшот детский базовый,1074
wildberries,Tiny Whale,Kids,Свитшот,Свитшот толстовка оверсайз,1056
wildberries,my FOX,Kids,Свитшот,Свитшот оверсайз свободная Толстовка,1856
wildberries,KETMIN,Kids,Свитшот,Свитшот детский в садик с легким начесом,715
wildberries,PremiumChess,Kids,Свитшот,Шахматный свитшот с принтом,535
wildberries,KETMIN,Kids,Свитшот,Свитшот детский в садик школу PREMIUM LINE,1241
wildberries,Art Kids,Kids,Свитшот,Cвитшот оверсайз с принтом теплый,1211
wildberries,ТЫСЯЧА СТОЛИЦ ДЕТЯМ,Kids,Свитшот,Свитшот с принтом,1197
wildberries,Momóco_trends,Kids,Свитшот,Свитшот детский оверсайз толстовка с рисунком,587
wildberries,SEMICVET,Kids,Свитшот,свитшот,989
wildberries,"ООО ""ЭЛЕТЕ""",Kids,Свитшот,Свитшот велюровый детский,
wildberries,Vsemaykiru,Kids,Свитшот,свитшот хлопок с принтом команды формулы 1,2529
wildberries,KOTON,Kids,Свитшот,Свитшот,313
wildberries,Bright&Chord,Kids,Свитшот,Свитшот,3659
wildberries,Konfetka_shop,Kids,Свитшот,Свитшот толстовка детская лонгслив в садик,573
wildberries,А4,Kids,Свитшот,Свитшот мерч Влад A4 оверсайз утепленная,1494
wildberries,MIX,Kids,Свитшот,Свитшот детский,
wildberries,JerseyLab,Kids,Свитшот,Тонкий свитшот с принтом для подростка,1108
wildberries,Drivemix,Kids,Свитшот,Свитшот толстовка оверсайз,766
wildberries,,Kids,Свитшот,Свитшот оверсайз футер,1442
wildberries,ELETE,Kids,Свитшот,Велюровый свитшот детский,442
wildberries,IVASHKA,Kids,Свитшот,Фэмили лук Свитшот джемпер детский новый год,406
wildberries,Konfetka_shop,Kids,Свитшот,Кофта свитшот детская лонгслив в садик,611
wildberries,A&E,Kids,Свитшот,Свитшот с начесом,1099
wildberries,FORTYFOUR,Kids,Свитшот,"Свитшот из футера Единорог, магия unicorn",2457
wildberries,ELETE,Kids,Свитшот,Свитшот новогодний с принтом,503
wildberries,TG Collection,Kids,Свитшот,Свитшот без начеса толстовка школьная,
wildberries,Woodcoon,Kids,Свитшот,Свитшот в полоску Битлджус Beetlejuice,779
wildberries,QRKIDS,Kids,Свитшот,Свитшот школьный для подростка хлопковый без начеса оверсайз,
wildberries,"ООО ""ЭЛЕТЕ""",Kids,Свитшот,Свитшот велюровый детский,442
wildberries,SIDaha,Kids,Свитшот,Свитшот детский,873
wildberries,Belkina,Kids,Свитшот,Свитшот теплый толстовка спортивная кофта оверсайз с начесом,1223
wildberries,Martina Kids,Kids,Свитшот,Футболка Свитшот,1073
wildberries,Каждому Своё Animals,Kids,Свитшот,Детский свитшот Гуси Gussi Гусь Goose Мем,993
wildberries,CRZ.Kids,Kids,Свитшот,Свитшот трикотажный с длинным рукавом детский,401
wildberries,Sherysheff,Kids,Свитшот,Свитшот теплый с карманом кенгуру,1357
wildberries,CARO NINO,Kids,Свитшот,Свитшот оверсайз толстовка с нашивкой мишкой,1146
wildberries,INSPOKIDS,Kids,Свитшот,Свитшот с начесом утепленный,1015
wildberries,Totti Kids,Kids,Свитшот,Свитшот спортивный детский теплый с начесом в школу,1410
wildberries,KOTON,Kids,Свитшот,Свитшот,305
wildberries,SEMICVET,Kids,Свитшот,Свитшот детский оверсайз спортивный джемпер,544
wildberries,V&Y_kids,Kids,Свитшот,Детский свитшот на мальчика,766
wildberries,SK,Kids,Свитшот,Кофта свитшот на молнии оверсайз,779
wildberries,Totti Kids,Kids,Свитшот,Свитшот спортивный детский теплый с начесом в школу,1644
wildberries,Go dream,Kids,Свитшот,Свитшот Гуси. силуэт,1266
wildberries,PELICAN,Kids,Свитшот,Свитшот для мальчиков и девочек с начесом,950
wildberries,BabyBunny,Kids,Свитшот,Свитшот оверсайз подростковый хлопок с лайкрой,994
wildberries,Generation NEXT,Kids,Свитшот,Свитшот для подростка Bad-Good,1283
wildberries,Стиляж,Kids,Свитшот,"Свитшот для мальчика, девочки модный стильный с принтом",1161
wildberries,Woodcoon,Kids,Свитшот,Свитшот с начесом детский,1030
wildberries,ИНОВО,Kids,Свитшот,Свитшот для мальчика оверсайз с принтом толстовка детская,421
wildberries,MomStory Design,Kids,Свитшот,Свитшот без начеса детский оверсайз с принтом,2210
wildberries,my FOX,Kids,Свитшот,Свитшот начес оверсайз свободная на флисе,1707
wildberries,Tuffy,Kids,Свитшот,Свитшот детский без начеса с принтом,764
wildberries,Vsemaykiru,Kids,Свитшот,"свитшот с принтом san jose sharks, сан хосе шаркс",2601
wildberries,ZevSyata,Kids,Свитшот,Свитшот из футера без начеса,752
wildberries,sGs - Street Grange Style,Kids,Свитшот,Свитшот школьный оверсайз толстовка с воротником,1448
wildberries,PIccaninny club KIDS,Kids,Свитшот,Свитшот для девочки мальчика оверсайз,893
wildberries,mjolk,Kids,Свитшот,Свитшот для девочки,1809
wildberries,C&A,Kids,Свитшот,свитшот,1076
wildberries,TONY BABY,Kids,Свитшот,свитшот с принтом,980
wildberries,Shabiy,Kids,Свитшот,свитшот,1293
wildberries,KettyKids,Kids,Свитшот,Свитшот для девочки,779
wildberries,Crazy beaver,Kids,Свитшот,Свитшот трикотажный оверсайз подростковый,801
wildberries,CRZ,Kids,Свитшот,Свитшот однотонный трикотажный оверсайз,575
wildberries,PELICAN,Kids,Свитшот,Свитшот оверсайз белый с принтом детский,976
wildberries,Uviton city,Kids,Свитшот,Свитшот теплый толстовка для малышей,574
wildberries,JUSUBAI,Kids,Свитшот,Свитшот подростковый оверсайз унисекс,1102
wildberries,EEkid,Kids,Свитшот,Свитшот детский теплый джемпер,687
wildberries,LikeAlice,Kids,Свитшот,Свитшот для мальчика с принтом,531
wildberries,ZevSyata,Kids,Свитшот,Свитшот из футера без начеса,674
wildberries,LEO,Kids,Свитшот,Свитшот детский спортивный толстовка детская,748
wildberries,Ticle,Men,Худи,Худи с начесом,2025
wildberries,Mahagon,Men,Худи,Худи оверсайз с капюшоном Y2K SK8,4586
wildberries,O'STIN,Men,Худи,Базовая толстовка худи с капюшоном,1195
wildberries,HDSTORE,Men,Худи,Зип худи оверсайз с капюшоном на молнии,
wildberries,QS by s.Oliver,Men,Худи,Толстовка мужская,2517
wildberries,BLACKPIRES,Men,Худи,Худи оверсайз с капюшоном,3439
wildberries,FUNDAY,Men,Худи,Толстовка,2246
wildberries,Perfect Fitness,Men,Худи,Худи оверсайз с капюшоном и начесом,2881
wildberries,HUGO BOSS,Men,Худи,Худи с капюшоном оверсайз без начеса,6153
wildberries,O'STIN,Men,Худи,Толстовка худи с капюшоном и принтом,1541
wildberries,JK Print,Men,Худи,Свитшот с принтом без начеса,1371
wildberries,New Life jersey,Men,Худи,Худи оверсайз с капюшоном теплое с начесом,1444
wildberries,BLACKPIRES,Men,Худи,Толстовка на молнии оверсайз,3611
wildberries,FUNDAY,Men,Худи,Худи,2742
wildberries,O'STIN,Men,Худи,Худи,1510
wildberries,2hoodies,Men,Худи,Худи оверсайз с капюшоном теплое с начесом,2292
wildberries,Decade,Men,Худи,толстовка олимпийка с капюшоном,1733
wildberries,Street Station,Men,Худи,Худи оверсайз y2k с начесом с принтом дрейн,3420
wildberries,JENO,Men,Худи,Зипка зип худи кофта на молнии с принтом аниме оверсайз y2k,1598
wildberries,Casual Shop Mocsow,Men,Худи,Худи на молнии с капюшоном,3661
wildberries,Мерч Мания,Men,Худи,Худи оверсайз дрейн Drain Gang style без карманов теплое,2734
wildberries,UNICOLOR.,Men,Худи,Худи оверсайз с начесом большие размеры,1280
wildberries,O'STIN,Men,Худи,Толстовка оверсайз однотонная с начёсом,1207
wildberries,Tishka,Men,Худи,Винтажное худи с принтом formula 1 кофта ferrari,2490
wildberries,,Men,Худи,Зип худи с мехом y2k,2497
wildberries,O'STIN,Men,Худи,Худи с капюшоном и карманом-кенгуру,1761
wildberries,Casual Shop Mocsow,Men,Худи,Худи на молнии с капюшоном,3765
wildberries,FUNDAY,Men,Худи,Классическая хлопковая толстовка худи с капюшоном,2865
wildberries,FUNDAY,Men,Худи,Толстовка,3209
wildberries,Lyle & Scott,Men,Худи,Толстовка с воротником на молнии синяя,5498
wildberries,ПромДизайн,Men,Худи,Толстовка флисовая на молнии,1258
wildberries,Zimberg,Men,Худи,Худи с капюшоном оверсайз,1027
wildberries,Blizi_Shop,Men,Худи,Зип худи Nike Tech Fleece,3198
wildberries,O'STIN,Men,Худи,Толстовка,4753
wildberries,Nicenonice,Men,Худи,Худи оверсайз Milf hunter,4413
wildberries,Befree,Men,Худи,Худи-зипка из футера с капюшоном,3699
wildberries,РА-17,Men,Худи,Кофта флисовая толстовка,1439
wildberries,NOTBRAND ATTITUDE,Men,Худи,Толстовка на молнии плюшевая флиска,3449
wildberries,VEX,Men,Худи,Зип худи с принтом лес зипка y2k камуфляж Realtree,2293
wildberries,O'STIN,Men,Худи,Толстовка,3098
wildberries,EMMA EG GEORGE,Men,Худи,Толстовка плюшевая зипка кофта розовая флиска овер,2001
wildberries,VEX,Men,Худи,Худи зип кроп на молнии Оверсайз,3301
wildberries,Nike,Men,Худи,Худи мужское оверсайз кофта толстовка без начеса,1705
wildberries,TOP&GO,Men,Худи,Худи оверсайз без начёса графитовая,1361
wildberries,Ohana market,Men,Худи,Худи оверсайз с начесом и капюшоном,1482
wildberries,LIACOLLECTION,Men,Худи,Худи оверсайз с капюшоном и начесом,1292
wildberries,Modjimoda,Men,Худи,Худи толстовка мужская с капюшоном,634
wildberries,COMANCHES,Men,Худи,Худи мужское оверсайз без начеса толстовка с капюшоном,1853
wildberries,Modjimoda,Men,Худи,Худи толстовка мужская с капюшоном,763
wildberries,ТЕЛОДВИЖЕНИЯ,Men,Худи,Худи оверсайз с капюшоном и начесом,2098
wildberries,ТЕЛОДВИЖЕНИЯ,Men,Худи,Худи оверсайз с капюшоном и начесом,1643
wildberries,SO-SIN,Men,Худи,Худи с капюшоном и начесом,2359
wildberries,HOODIE STORE,Men,Худи,Худи мужское оверсайз с капюшоном,1364
wildberries,UZcotton,Men,Худи,Худи оверсайз антрацит теплое с начесом,1199
wildberries,DOMFAWN,Men,Худи,худи оверсайз с капюшоном теплое с начёсом,1103
wildberries,Сити Текс,Men,Худи,Худи оверсайз с капюшоном и начесом,1684
wildberries,Kinetix Digital,Men,Худи,Базовое оверсайз худи с легким начесом,1187
wildberries,TOP&GO,Men,Худи,Худи оверсайз без начеса черное,1361
wildberries,Nike,Men,Худи,Худи на замке зип оверсайз Толстовка на молнии кофта,1895
wildberries,Setner,Men,Худи,Худи с начесом оверсайз с принтом,2231
wildberries,ТЕЛОДВИЖЕНИЯ,Men,Худи,Худи подарок мужчине оверсайз с капюшоном и начесом,1911
wildberries,VIBE&STYLE,Men,Худи,Худи оверсайз,1581
wildberries,Kinetix Digital,Men,Худи,Базовое оверсайз худи с легким начесом,1393
wildberries,Nike,Men,Худи,Худи мужское серое найк толстовка без начеса,1753
wildberries,ТЕЛОДВИЖЕНИЯ,Men,Худи,Худи оверсайз с капюшоном и начесом,2216
wildberries,Tommy Sport,Men,Худи,Худи с капюшоном теплый с начесом,2247
wildberries,VIBE&STYLE,Men,Худи,Худи оверсайз с капюшоном,1530
wildberries,SO-SIN,Men,Худи,Худи оверсайз с принтом,2257
wildberries,Palmost,Men,Худи,Худи оверсайз с принтом аниме кофта y2k,1979
wildberries,Tommy Sport,Men,Худи,Худи с капюшоном теплый с начесом,1990
wildberries,MARMOR,Men,Худи,Худи без начеса оверсайз толстовка с капюшоном,1572
wildberries,MR BIGMAN,Men,Худи,Худи с начесом большие размеры,1834
wildberries,ТЕЛОДВИЖЕНИЯ,Men,Худи,Худи оверсайз с капюшоном и начесом,1528
wildberries,VIBE&STYLE,Men,Худи,Худи оверсайз с капюшоном,1581
wildberries,Liasta,Men,Худи,Худи оверсайз с капюшоном теплое с начесом,1344
wildberries,Mantra Digital,Men,Худи,Худи оверсайз с капюшоном и легким начесом,1364
wildberries,MAFISHKA,Men,Худи,Худи барашек с вышивкой NIKE,2073
wildberries,ТЕЛОДВИЖЕНИЯ,Men,Худи,Худи оверсайз с принтом BROOKLYN утепленное,2116
wildberries,ТВОЕ,Men,Худи,Худи оверсайз с капюшоном и начесом,1537
wildberries,Ravenclo,Men,Худи,Оверсайз худи,2334
wildberries,AXXELLA,Men,Худи,Толстовка на молнии зипка оверсайз,1388
wildberries,ТЕЛОДВИЖЕНИЯ,Men,Худи,Худи оверсайз с капюшоном и начесом,1834
wildberries,Tommy Sport,Men,Худи,Худи с капюшоном теплый с начесом,2695
wildberries,TOP&GO,Men,Худи,Толстовка зипка с капюшоном с микроначесом,1632
wildberries,Nicenonice,Men,Худи,Худи оверсайз 4 20 жму на старт,3310
wildberries,ТЕЛОДВИЖЕНИЯ,Men,Худи,Худи оверсайз с капюшоном и начесом,2063
wildberries,MATERIA,Men,Худи,Худи оверсайз без начёса с капюшоном,3530
wildberries,FANBOX,Men,Худи,Худи оверсайз с капюшоном,2793
wildberries,ТВОЕ,Men,Худи,Худи оверсайз с капюшоном и начесом,1487
