Marketplace,Brand,Gender,SearchQuery,ProductName,Price
wildberries,ELENDORA,Women,Брюки,Брюки классические зауженные,3435
wildberries,bemalux,Women,Брюки,Брюки женские палаццо классические,1689
wildberries,Feelz_DISCOUNT,Women,Брюки,Брюки карго палаццо Vert,1421
wildberries,oodji,Women,Брюки,Брюки трикотажные скинни,1575
wildberries,AITA MODA,Women,Брюки,Брюки палаццо летние на резинке больших размеров,1098
wildberries,AMINA FASHION,Women,Брюки,Брюки вельветовые,1479
wildberries,DITE,Women,Брюки,Прямые брюки женские утепленные зимние,4202
wildberries,TSYRTSOV,Women,Брюки,Брюки в клетку классические утепленные прямые,3070
wildberries,,Women,Брюки,Брюки кюлоты широкие летние на резинке,726
wildberries,BURHAN TEX,Women,Брюки,Спортивные брюки бананы на резинке,641
wildberries,AJUTOR,Women,Брюки,Классические брюки больших размеров в полоску,2178
wildberries,ATELITA,Women,Брюки,Брюки классические прямые офисные на резинке,1907
wildberries,BERSI,Women,Брюки,Брюки укороченные бананы женские,
wildberries,ZaFamily,Women,Брюки,Школьные брюки с карманами для подростка,682
wildberries,MYSHKYN,Women,Брюки,Брюки карго палаццо атласные,3191
wildberries,EVVER,Women,Брюки,Брюки летние на резинке,1444
wildberries,Keiris,Women,Брюки,Брюки палаццо классические утепленные широкие,3190
wildberries,Laween,Women,Брюки,Юбка брюки больших размеров летние широкие,3741
wildberries,WONESS,Women,Брюки,Штаны теплые женские с начесом,987
wildberries,Медицина Плюс,Women,Брюки,Брюки медицинские женские спецодежда,565
wildberries,BERSI,Women,Брюки,Брюки трикотажные вельветовые,917
wildberries,,Women,Брюки,Спортивные штаны джоггеры широкие,670
wildberries,Elisabeth Lee,Women,Брюки,Брюки спортивные утепленные джоггеры с начесом,2059
wildberries,LUXTEX,Women,Брюки,Брюки классические офисные джоггеры на резинке Беларусь,2598
wildberries,CC HOME,Women,Брюки,Широкие брюки классические палаццо,2687
wildberries,Care for you,Women,Брюки,Штаны спортивные,2216
wildberries,Asinur,Women,Брюки,Брюки спортивные свободные джоггеры бананы,636
wildberries,Tommy Sport,Women,Брюки,Брюки спортивные с начесом,1760
wildberries,Тебе понравится,Women,Брюки,Брюки палаццо классические школьные,1100
wildberries,JellyFox,Kids,Брюки,Брюки джоггеры детские теплые с подкладкой,735
wildberries,H&M,Kids,Брюки,Брюки спортивные джоггеры детские - набор 3 шт,2671
wildberries,Naruto,Kids,Брюки,Трикотажные брюки джоггеры Наруто,532
wildberries,Crazy beaver.Kids,Kids,Брюки,Брюки джоггеры детские утепленные на резинке,1639
wildberries,,Kids,Брюки,Спортивные штаны джоггеры,
wildberries,Crockid,Kids,Брюки,Брюки ветровочные весенние,2567
wildberries,Anh Tuan Shop,Kids,Брюки,Брюки,627
wildberries,Happy Baby,Kids,Брюки,88190 Брюки детские light-blue cell,1364
wildberries,Oldos,Kids,Брюки,Брюки зимние,3056
wildberries,BODO,Kids,Брюки,Брюки на флисе весенние,2154
wildberries,KROHAPPY,Kids,Брюки,Брюки детские спортивные джоггеры,764
wildberries,Мое солнышко.м,Kids,Брюки,Набор брюк для детей,793
wildberries,TONY BABY,Kids,Брюки,спортивные штаны nike,764
wildberries,Мимики,Kids,Брюки,Спортивные брюки для детей,374
wildberries,CN908,Kids,Брюки,Зимние брюки утепленные с мембраной и подтяжками,2200
wildberries,BODO,Kids,Брюки,Брюки спортивные с начесом,2411
wildberries,Уси-Пуси,Kids,Брюки,Детские вязаные брюки рейтузы,525
wildberries,Bum Bov,Kids,Брюки,Штаны демисезонные болоньевые утепленные детские,859
wildberries,ту_ту,Kids,Брюки,детские спортивные брюки,707
wildberries,Let's Go,Kids,Брюки,Брюки школьные на резинке с карманами,1047
wildberries,I-KEN,Kids,Брюки,Штаны теплые с начесом,993
wildberries,UZcotton,Kids,Брюки,Брюки молочного цвета подростковые с начесом,664
wildberries,adidas,Kids,Брюки,Брюки U BL PANT,2396
wildberries,BOO&LOO,Kids,Брюки,"Брюки детские утепленные с начесом, вельветовые",1843
wildberries,9+1 МИР,Kids,Брюки,брюки детские камуфляж,699
wildberries,LAMARK,Kids,Брюки,Брюки домашние трикотажные с манжетами в садик,411
wildberries,Leratutti,Kids,Брюки,Брюки спортивные,635
wildberries,R.outfit,Kids,Брюки,Брюки детские льняные,1452
wildberries,BODO,Kids,Брюки,Брюки карго спортивные,1797
wildberries,VMS.design,Kids,Брюки,Болоньевые штаны детские утепленные непромокаемые,1760
wildberries,vgtrikotazh,Kids,Брюки,Брюки непромокаемые СОФТШЕЛЛ,1738
wildberries,AlexBabyLiz,Kids,Брюки,Вельветовые брюки детские,428
wildberries,LuckyMom,Kids,Брюки,Брюки плащевые непромокаемые,724
wildberries,LAMARK,Kids,Брюки,Спортивные штаны детские,483
wildberries,Ниточки-Клубочки,Kids,Брюки,Штаны вязаные на бретелях для малышей,1319
wildberries,Crockid,Kids,Брюки,Брюки для новорождённых в упаковке 2 шт,691
wildberries,Соль&Перец,Kids,Брюки,Брюки карго подростковые парашюты у2к,1719
wildberries,Yusma,Kids,Брюки,Брюки детские вельветовые,1314
wildberries,Let`s Go,Kids,Брюки,Штаны спортивные,978
wildberries,ZipkidZ,Kids,Брюки,Брюки утепленные для мальчика и для девочки из мембраны,2201
wildberries,QRKIDS,Kids,Брюки,Брюки летние лен широкие бананы,2086
wildberries,Love is baby,Kids,Брюки,Брюки джоггеры карго детские с карманами на резинке весна,1478
wildberries,Малинка,Kids,Брюки,Брюки спортивные детские с начёсом,823
wildberries,puZZiki.,Kids,Брюки,Брюки для мальчика школьные подростковые,621
wildberries,Silver Kids,Kids,Брюки,Костюм демисезонный детский,4405
wildberries,BOO&LOO,Kids,Брюки,Брюки вельветовые на резинке,1843
wildberries,ШТАНЫ,Kids,Брюки,Брюки спортивные,940
wildberries,GALLANT fashion,Kids,Брюки,Утепленные брюки школьные подростковые на флисе,1386
wildberries,Maryam Nazar,Kids,Брюки,Штаны спортивные джоггеры для подростка,536
wildberries,BODO,Kids,Брюки,Брюки спортивные,1155
wildberries,Happy Baby,Kids,Брюки,Брюки детские на флисе трансформеры,2549
wildberries,LEO,Kids,Брюки,Брюки из муслина джоггеры хлопковые для малыша,609
wildberries,GECOTTON,Kids,Брюки,Спортивные штаны джоггеры детские,680
wildberries,KOGANKIDS,Kids,Брюки,Брюки детские муслин для девочки или мальчика,583
wildberries,Topotushki,Kids,Брюки,Штанишки для новорожденных,678
wildberries,Lassie,Kids,Брюки,Брюки,752
wildberries,TH kids,Kids,Брюки,Брюки трикотажные для подростка,737
wildberries,Linas Baby,Kids,Брюки,Брюки вязаные теплые бесшовные,435
wildberries,BODO,Kids,Брюки,Брюки карго,1797
wildberries,byDiLen,Kids,Брюки,Спортивные штаны для девочки,1093
wildberries,Егоzzа,Kids,Брюки,"Штанишки детские, ясельные на манжете",343
wildberries,Detki,Kids,Брюки,Брюки палаццо спортивные с лампасами,1872
wildberries,KETMIN,Kids,Брюки,Брюки детские мембрана демисезонные,1390
wildberries,PELICAN,Kids,Брюки,Брюки для мальчика спортивные школьные,1077
wildberries,Winkiki,Kids,Брюки,Брюки спортивные,870
wildberries,Crockid,Kids,Брюки,Брюки для новорождённых в упаковке 2 шт хлопок,691
wildberries,Baby Sun,Kids,Брюки,Брюки вельветовые детские джоггеры,1268
wildberries,Иваново кидс,Kids,Брюки,Брюки спортивные школьные джоггеры на резинке комплект 3 шт,1120
wildberries,Anh Tuan Shop,Kids,Брюки,Брюки,666
wildberries,Happy Baby,Kids,Брюки,Брюки детские флисовые,2199
wildberries,ДО-Детская Одежда,Kids,Брюки,Брюки школьные на резинке,848
wildberries,Сима-Ленд & MINAKU,Kids,Брюки,Брюки детские рейтузы,1157
wildberries,LAMARK,Kids,Брюки,Штаны трикотажные домашние в садик,411
wildberries,NELS,Kids,Брюки,Брюки водонепроницаемые детские,1326
wildberries,MILKIBALA,Kids,Брюки,Штаны софтшелл демисезонные для мальчика и девочки,1130
wildberries,Lassie,Kids,Брюки,Брюки,1555
wildberries,Nana kids,Kids,Брюки,Брюки Детские Спортивные,668
wildberries,Topotushki,Kids,Брюки,Штанишки для малышей,426
wildberries,Reima,Kids,Брюки,Брюки,
wildberries,Валерия Мура,Kids,Брюки,Брюки,707
wildberries,Crockid,Kids,Брюки,Спортивные брюки для мальчиков на резинке,1374
wildberries,Югтекстильторг,Kids,Брюки,Брюки ластовицей,280
wildberries,BOO&LOO,Kids,Брюки,Брюки карго на резинке,1742
wildberries,MiniDino,Kids,Брюки,Брюки стеганые непромокаемые,1504
wildberries,Еся здеся,Kids,Брюки,Штаны с плюшевой подкладкой и карманами,1087
wildberries,Кактус,Kids,Брюки,Брюки спортивные школьные на резинке,1281
wildberries,LoArKa,Kids,Брюки,Штаны спортивные джоггеры с карманами и принтом,1261
wildberries,VNL,Kids,Брюки,Штаны широкие палаццо рваные,1128
wildberries,KiMMi&co,Kids,Брюки,Брюки,617
wildberries,Vsemaykiru,Kids,Брюки,брюки с принтом Огонь с искрами,2524
wildberries,cloberry,Kids,Брюки,Брюки флисовые,379
wildberries,МИКИТА,Kids,Брюки,Штаны флисовые с удлиненными манжетами,709
wildberries,Ниточки-Клубочки,Kids,Брюки,Штаны гамаши лосины вязаные в рубчик,1229
wildberries,Reima,Kids,Брюки,Брюки,2266
wildberries,BrandOVA,Kids,Брюки,Брюки карго для мальчика и девочки на резинке,1096
wildberries,SASHA KIDZ,Kids,Брюки,штаны с начесом трикотажные,1065
wildberries,TRILONI,Kids,Брюки,Штаны джоггеры повседневные футер,384
wildberries,Рыжик,Kids,Брюки,Спортивные штаны брюки детские для мальчика девочки,776
wildberries,KROHAPPY,Kids,Брюки,Брюки детские спортивные в школу и садик,876
wildberries,LOLOCLO,Kids,Брюки,Брюки с отстрочкой из кашкорсе детские,2168
wildberries,my FOX,Kids,Брюки,Брюки спортивные джоггеры для хип-хопа оверсайз,1872
wildberries,Button Blue,Kids,Брюки,Джоггеры карго,1446
wildberries,BODO,Kids,Брюки,Брюки спортивные,1316
wildberries,Bossa Nova,Kids,Брюки,Брюки для мальчика и девочки подростка спортивные в садик,859
wildberries,Oldos,Kids,Брюки,Брюки утепленные зимние,3634
wildberries,BOO&LOO,Kids,Брюки,"Брюки утепленные, вельветовые",1843
wildberries,VMS.design,Kids,Брюки,Болоньевые штаны детские утепленные непромокаемые,1797
wildberries,MF,Kids,Брюки,Брюки детские с принтом,1214
wildberries,9+1 МИР,Kids,Брюки,детские спортивные брюки,677
wildberries,,Kids,Брюки,Брюки джоггеры вельветовые утепленные с начесом,1274
wildberries,KELME,Kids,Брюки,Вратарские штаны для футбола,
wildberries,Jeestyle,Kids,Брюки,Брюки спортивные,733
wildberries,Berega STUDIOS,Kids,Брюки,Брюки трикотажные детские,588
wildberries,Gerand,Kids,Брюки,Костюм худи и штаны Геранд,3712
wildberries,Лиилаа,Kids,Брюки,Брюки джоггеры трикотажные детские на резинке,874
wildberries,BODO,Kids,Брюки,Брюки с начёсом весна,1421
wildberries,VaNechKa,Kids,Брюки,"брюки для детей, штаны для детей",608
wildberries,Lesa kids,Kids,Брюки,Теплые спортивные штаны с начесом,535
wildberries,Kindom,Kids,Брюки,Штаны зимние утепленные на резинке,1462
wildberries,Woodcoon,Kids,Брюки,Брюки детские спортивные с начесом,1152
wildberries,Stylish АМАDЕО,Kids,Брюки,Штаны мембрана непромокаемые softshell,2223
wildberries,VAR кидс,Kids,Брюки,Штаны спортивные детские комплект 3 шт,1529
wildberries,Соловьиная карусель,Kids,Брюки,Спортивные штаны с начёсом,794
wildberries,Кактус,Kids,Брюки,Брюки спортивные школьные на резинке,518
wildberries,GOHA KIDS,Kids,Брюки,Брюки детские,1063
wildberries,Premont,Kids,Брюки,Зимние мембранные брюки,4347
wildberries,R.M kids,Kids,Брюки,Брюки кожаные палаццо подростковые,757
wildberries,WYC,Kids,Брюки,Штаны в клетку для девочек мальчика подростковые широкие,586
wildberries,Democracy,Kids,Брюки,Брюки утепленные зимние на резинке,1503
wildberries,Кактус,Kids,Брюки,Брюки спортивные школьные на резинке,408
wildberries,NinoMio,Kids,Брюки,Брюки джоггеры спортивные,539
wildberries,Lassie,Kids,Брюки,Брюки зимние теплые с подтяжками,1256
wildberries,Reima,Kids,Брюки,Брюки,1002
wildberries,HH kids,Kids,Брюки,Спортивные штаны для подростка,421
wildberries,Jamm kids,Kids,Брюки,Брюки непромокаемые софтшелл,1528
wildberries,BODO,Kids,Брюки,Брюки непромокаемые СОФТШЕЛЛ весна,1529
wildberries,KOGANKIDS,Kids,Брюки,Спортивные брюки для девочки теплые с начесом,1291
wildberries,TG Collection,Kids,Брюки,Брюки школьные классические на резинке,
wildberries,zaiki-mishki,Kids,Брюки,Брюки софтшелл весна непромокаемые,2097
wildberries,Nikki bambino,Kids,Брюки,Зимние брюки,4172
wildberries,MamiDreams,Kids,Брюки,Штаны теплые,1261
wildberries,Уси-Пуси,Kids,Брюки,Брюки(рейтузы)детские для новорожденных,518
wildberries,Anh Tuan Shop,Kids,Брюки,Брюки,611
wildberries,Woodcoon,Kids,Брюки,Брюки в полоску детские из жаккарда,1108
wildberries,Sofuto,Kids,Брюки,Брюки мембранные,3922
wildberries,ТМ Валерика,Kids,Брюки,Штаны детские джоггеры на резинке,418
wildberries,PUERI,Kids,Брюки,Брюки детские демисезонные мембрана без утеплителя,1262
wildberries,LesiKids,Kids,Брюки,Спортивные штаны для подростка джоггеры без начеса,1130
wildberries,Symbion,Kids,Брюки,Брюки непромокаемые с флисом,968
wildberries,Уси-Пуси,Kids,Брюки,Брюки(рейтузы) вязаные детские,478
wildberries,Happy Baby,Kids,Брюки,Брюки палаццо вязаные,2499
wildberries,VikishopKids,Kids,Брюки,Детские вельветовые брюки с начесом оверсайз,1130
wildberries,Woodcoon,Kids,Брюки,Брюки спортивные,1136
wildberries,Иваново кидс,Kids,Брюки,Штанишки для новорожденных малышей набор 3 шт,761
wildberries,M-BRAND,Kids,Брюки,Штаны спортивные подростковые весна,
wildberries,Color Kids,Kids,Брюки,Брюки горнолыжные детские утепленные,5291
wildberries,Lassie,Kids,Брюки,Штаны детские горнолыжные утепленные,4409
wildberries,Lassie,Kids,Брюки,Штаны детские оверсайз,2507
wildberries,Pumbie,Kids,Брюки,Брюки детские для подростка школьные в клетку,1356
wildberries,Кактус,Kids,Брюки,Брюки спортивные школьные на резинке,403
wildberries,KIOKO JUNIOR,Kids,Брюки,Брюки спортивные карго детские,733
wildberries,I-KEN,Kids,Брюки,Штаны спортивные на резинке,1077
wildberries,CHELEBI,Kids,Брюки,Челеби-Текстиль,900
wildberries,Bum Buv,Kids,Брюки,Брюки детские на флисе,756
wildberries,Kada,Kids,Брюки,Брюки палаццо спортивные с лампасами и карманами,1890
wildberries,Oldos,Kids,Брюки,Брюки демисезонные детские,1336
wildberries,DLN,Kids,Брюки,Брюки на флисе непромокаемые утепленные,1223
wildberries,ШТАНЫ,Kids,Брюки,Брюки спортивные,1176
wildberries,PINIGO,Kids,Брюки,Брюки флисовые,421
wildberries,BODO,Kids,Брюки,Брюки широкие весенние,3348
wildberries,KELME,Kids,Брюки,Спортивные штаны Вратарские брюки с защитными вставками,2363
wildberries,KROHAPPY,Kids,Брюки,Брюки детские спортивные джоггеры на физкультуру для школы,1229
wildberries,ТИГРИС,Kids,Брюки,Брюки зимние на синтепоне PLUS SIZE,1666
wildberries,Лучшие наряды,Men,Рубашка,Рубашка с длинным рукавом приталенная,893
wildberries,Best TAILOR,Men,Рубашка,Рубашка в клетку с коротким рукавом,1123
wildberries,ART FAMILY,Men,Рубашка,Рубашка в клетку оверсайз теплая,1862
wildberries,HEISEDE,Men,Рубашка,Рубашка джинсовая на кнопках с длинным рукавом,3557
wildberries,oodji,Men,Рубашка,Рубашка классическая из фактурной ткани,1012
wildberries,Le Valdo,Men,Рубашка,Рубашка в клетку с длинным рукавом,2694
wildberries,DS-БЕРА,Men,Рубашка,Рубашка с длинным рукавом классическая,1722
wildberries,Paolo Marni,Men,Рубашка,рубашка белая хлопковая классическая с длинным рукавом,1681
wildberries,Le Valdo,Men,Рубашка,Рубашка-куртка на флисе утепленная,2460
wildberries,Envy Lab,Men,Рубашка,Рубашка Классическая Приталенная,1971
wildberries,BARZAN,Men,Рубашка,Рубашка приталенная с длинным рукавом,1070
wildberries,TopEngi,Men,Рубашка,Рубашка с длинным рукавом оверсайз,1050
wildberries,SHOP_МАЭЛ,Men,Рубашка,Рубашка,1138
wildberries,MadeInChng,Men,Рубашка,Рубашка муслиновая,1876
wildberries,KL & KN,Men,Рубашка,рубашка классическая с длинным рукавом,891
wildberries,YXC,Men,Рубашка,Рубашка приталенная с длинным рукавом на кнопках,1937
wildberries,Brostem,Men,Рубашка,Рубашка с длинным рукавом на кнопках черная,1853
wildberries,88 store,Men,Рубашка,Рубашка в клетку с длинным рукавом оверсайз,1165
wildberries,Le Valdo,Men,Рубашка,Рубашка в клетку с длинным рукавом,1738
wildberries,100 Пудов,Men,Рубашка,Рубашка в клетку с длинным рукавом,1251
wildberries,Hooligan STORE multibrand,Men,Рубашка,Рубашка вельветовая оверсайз,1618
wildberries,GENTFIT,Men,Рубашка,Рубашка приталенная на кнопках с воротником стойкой,2338
wildberries,Solo Ferini,Men,Рубашка,Рубашка,977
wildberries,ddd,Men,Рубашка,Рубашка классическая,730
wildberries,Le Valdo,Men,Рубашка,Рубашка-куртка на флисе утепленная,2621
wildberries,MAYT,Men,Рубашка,Рубашка мужская с длинным рукавом приталенная классическая,2227
wildberries,TezTik,Men,Рубашка,Рубашка с длинным рукавом в стиле old money,1467
wildberries,SHEEFR,Men,Рубашка,Рубашка оверсайз вельветовая,2299
wildberries,alato,Men,Рубашка,Рубашка в клетку с длинным рукавом,1684
wildberries,TFcollection,Men,Рубашка,Рубашка с длинным рукавом без воротника,1638
wildberries,HENDERSON,Men,Рубашка,Рубашка Non-Iron,2888
wildberries,Yarkaya,Men,Рубашка,Рубашка оверсайз широкая прямая в полоску корея Y2K,1611
wildberries,YES ME,Men,Рубашка,Рубашка оверсайз фланелевая в клетку,1650
wildberries,iG,Men,Рубашка,Рубашка с длинным рукавом приталенная на кнопках,1898
wildberries,woodson,Men,Рубашка,Рубашка для парения в бане льняная,6766
wildberries,MIXЕRS SHIRT,Men,Рубашка,Рубашка классическая приталенная с воротником стойкой,1528
wildberries,Богатырь,Men,Рубашка,Рубашка в клетку фланелевая больших размеров,926
wildberries,LC Waikiki,Men,Рубашка,Рубашка,618
wildberries,MIXERS,Men,Рубашка,Рубашка мужская с длинным рукавом классическая,1025
wildberries,Lyle & Scott,Men,Рубашка,Рубашка с длинным рукавом классическая хлопок 100%,2596
wildberries,Brostem,Men,Рубашка,Рубашка праздничная с длинным рукавом в клетку,1198
wildberries,TOM TAILOR,Men,Рубашка,Рубашка в клетку,3209
wildberries,MAZZARO,Men,Рубашка,Рубашка с длинным рукавом в полоску,2266
wildberries,italomania,Men,Рубашка,Рубашка с длинным рукавом хлопок,775
wildberries,TLG,Men,Рубашка,Рубашка теплая в клетку,1111
wildberries,U.S. Polo Assn.,Men,Рубашка,Рубашка однотонная,2886
